{
  "formatVersion": 1,
  "id": "kubohiroyaassetmanager",
  "blocks": [
    {
      "opcode": "isLoaded",
      "blockType": "BOOLEAN",
      "arguments": [{"id": "NAME", "type": "STRING"}]
    },
    {
      "opcode": "registerAsset",
      "blockType": "COMMAND",
      "arguments": [
        {"id": "NAME", "type": "STRING"},
        {"id": "RESOURCE_ID", "type": "STRING"}
      ]
    }
  ],
  "menus": []
}
