{
  "formatVersion": 1,
  "id": "kubohiroyaturbowarphttpserver",
  "blocks": [
    {
      "opcode": "clearHttpLogs",
      "blockType": "COMMAND",
      "arguments": []
    },
    {
      "opcode": "connect",
      "blockType": "COMMAND",
      "arguments": []
    },
    {
      "opcode": "currentHttpMethod",
      "blockType": "REPORTER",
      "arguments": []
    },
    {
      "opcode": "currentRequestBody",
      "blockType": "REPORTER",
      "arguments": []
    },
    {
      "opcode": "currentRequestClientAddress",
      "blockType": "REPORTER",
      "arguments": []
    },
    {
      "opcode": "currentRequestContentType",
      "blockType": "REPORTER",
      "arguments": []
    },
    {
      "opcode": "currentRequestId",
      "blockType": "REPORTER",
      "arguments": []
    },
    {
      "opcode": "currentRequestPath",
      "blockType": "REPORTER",
      "arguments": []
    },
    {
      "opcode": "currentRequestUrl",
      "blockType": "REPORTER",
      "arguments": []
    },
    {
      "opcode": "currentResponseStatus",
      "blockType": "REPORTER",
      "arguments": []
    },
    {
      "opcode": "disconnect",
      "blockType": "COMMAND",
      "arguments": []
    },
    {
      "opcode": "htmlAppendChild",
      "blockType": "REPORTER",
      "arguments": [
        {
          "id": "CHILD",
          "type": "STRING"
        },
        {
          "id": "PARENT",
          "type": "STRING"
        }
      ]
    },
    {
      "opcode": "htmlSetAttribute",
      "blockType": "REPORTER",
      "arguments": [
        {
          "id": "NAME",
          "type": "STRING"
        },
        {
          "id": "NODE",
          "type": "STRING"
        },
        {
          "id": "VALUE",
          "type": "STRING"
        }
      ]
    },
    {
      "opcode": "htmlText",
      "blockType": "REPORTER",
      "arguments": [
        {
          "id": "TEXT",
          "type": "STRING"
        }
      ]
    },
    {
      "opcode": "httpLogViewerHtml",
      "blockType": "REPORTER",
      "arguments": []
    },
    {
      "opcode": "httpLogViewerHtmlFromJson",
      "blockType": "REPORTER",
      "arguments": [
        {
          "id": "LOGS",
          "type": "STRING"
        }
      ]
    },
    {
      "opcode": "isConnected",
      "blockType": "BOOLEAN",
      "arguments": []
    },
    {
      "opcode": "lastMessage",
      "blockType": "REPORTER",
      "arguments": []
    },
    {
      "opcode": "markdownBullet",
      "blockType": "REPORTER",
      "arguments": [
        {
          "id": "DOC",
          "type": "STRING"
        },
        {
          "id": "TEXT",
          "type": "STRING"
        }
      ]
    },
    {
      "opcode": "markdownCodeBlock",
      "blockType": "REPORTER",
      "arguments": [
        {
          "id": "CODE",
          "type": "STRING"
        },
        {
          "id": "DOC",
          "type": "STRING"
        },
        {
          "id": "LANG",
          "type": "STRING"
        }
      ]
    },
    {
      "opcode": "markdownHeading",
      "blockType": "REPORTER",
      "arguments": [
        {
          "id": "DOC",
          "type": "STRING"
        },
        {
          "id": "LEVEL",
          "type": "NUMBER"
        },
        {
          "id": "TEXT",
          "type": "STRING"
        }
      ]
    },
    {
      "opcode": "markdownParagraph",
      "blockType": "REPORTER",
      "arguments": [
        {
          "id": "DOC",
          "type": "STRING"
        },
        {
          "id": "TEXT",
          "type": "STRING"
        }
      ]
    },
    {
      "opcode": "newHtmlElement",
      "blockType": "REPORTER",
      "arguments": [
        {
          "id": "TAG",
          "type": "STRING"
        }
      ]
    },
    {
      "opcode": "newMarkdownDocument",
      "blockType": "REPORTER",
      "arguments": []
    },
    {
      "opcode": "pathParameter",
      "blockType": "REPORTER",
      "arguments": [
        {
          "id": "NAME",
          "type": "STRING"
        }
      ]
    },
    {
      "opcode": "queryParameter",
      "blockType": "REPORTER",
      "arguments": [
        {
          "id": "NAME",
          "type": "STRING"
        }
      ]
    },
    {
      "opcode": "recordHttpLog",
      "blockType": "COMMAND",
      "arguments": [
        {
          "id": "ENTRY",
          "type": "STRING"
        }
      ]
    },
    {
      "opcode": "removeResponseHeader",
      "blockType": "COMMAND",
      "arguments": [
        {
          "id": "NAME",
          "type": "STRING"
        }
      ]
    },
    {
      "opcode": "renderHtml",
      "blockType": "REPORTER",
      "arguments": [
        {
          "id": "NODE",
          "type": "STRING"
        }
      ]
    },
    {
      "opcode": "renderHtmlDocument",
      "blockType": "REPORTER",
      "arguments": [
        {
          "id": "BODY",
          "type": "STRING"
        },
        {
          "id": "TITLE",
          "type": "STRING"
        }
      ]
    },
    {
      "opcode": "renderMarkdown",
      "blockType": "REPORTER",
      "arguments": [
        {
          "id": "DOC",
          "type": "STRING"
        }
      ]
    },
    {
      "opcode": "requestHeader",
      "blockType": "REPORTER",
      "arguments": [
        {
          "id": "NAME",
          "type": "STRING"
        }
      ]
    },
    {
      "opcode": "respondWithHtml",
      "blockType": "COMMAND",
      "arguments": [
        {
          "id": "BODY",
          "type": "STRING"
        }
      ]
    },
    {
      "opcode": "respondWithJson",
      "blockType": "COMMAND",
      "arguments": [
        {
          "id": "BODY",
          "type": "STRING"
        }
      ]
    },
    {
      "opcode": "respondWithText",
      "blockType": "COMMAND",
      "arguments": [
        {
          "id": "BODY",
          "type": "STRING"
        }
      ]
    },
    {
      "opcode": "responseHeader",
      "blockType": "REPORTER",
      "arguments": [
        {
          "id": "NAME",
          "type": "STRING"
        }
      ]
    },
    {
      "opcode": "sendResponse",
      "blockType": "COMMAND",
      "arguments": [
        {
          "id": "BODY",
          "type": "STRING"
        }
      ]
    },
    {
      "opcode": "sendText",
      "blockType": "COMMAND",
      "arguments": [
        {
          "id": "MESSAGE",
          "type": "STRING"
        }
      ]
    },
    {
      "opcode": "setHttpStatus",
      "blockType": "COMMAND",
      "arguments": [
        {
          "id": "STATUS",
          "type": "NUMBER"
        }
      ]
    },
    {
      "opcode": "setResponseBody",
      "blockType": "COMMAND",
      "arguments": [
        {
          "id": "BODY",
          "type": "STRING"
        }
      ]
    },
    {
      "opcode": "setResponseHeader",
      "blockType": "COMMAND",
      "arguments": [
        {
          "id": "NAME",
          "type": "STRING"
        },
        {
          "id": "VALUE",
          "type": "STRING"
        }
      ]
    },
    {
      "opcode": "setServerUrl",
      "blockType": "COMMAND",
      "arguments": [
        {
          "id": "URL",
          "type": "STRING"
        }
      ]
    },
    {
      "opcode": "useHttpRequest",
      "blockType": "COMMAND",
      "arguments": [
        {
          "id": "ID",
          "type": "STRING"
        }
      ]
    },
    {
      "opcode": "whenHttpRequestReceived",
      "blockType": "HAT",
      "arguments": []
    }
  ],
  "menus": []
}
